{
  "$schema": "../engine/schemas/course.schema.json",
  "schemaVersion": 1,
  "courseId": "fixture-minimal",
  "grade": 7,
  "title": "合成测试课程",
  "version": "0.1.0",
  "profile": "figure",
  "engine": {
    "range": "^1.0.0",
    "requiredCapabilities": [
      "file-runtime",
      "post-message",
      "left-right",
      "latex",
      "choice",
      "replace-key",
      "figure-state"
    ]
  },
  "authoring": {
    "rootKey": "authoringSource",
    "problems": [
      {
        "problemId": "problem-a",
        "order": 1,
        "actionPrefix": "测试",
        "planPath": "authoring/problem-a/plan.json"
      },
      {
        "problemId": "problem-b",
        "order": 2,
        "actionPrefix": "测试练",
        "planPath": "authoring/problem-b/plan.json"
      },
      {
        "problemId": "problem-c",
        "order": 3,
        "actionPrefix": "测试作业",
        "planPath": "authoring/problem-c/plan.json"
      }
    ]
  },
  "authoredModules": [
    "lesson/modules/_synthetic-board-figure.js"
  ],
  "extensions": []
}
